{"avoid_when":"维护老旧 webpack-only 流水线且无迁移窗口","content_hash":"f1263d54648df6b53301a6ddf61c52fd0ee8d20bde622a289c8c6fbd66edad58","domain":"web-frontend","evidence_urls":["https://github.com/vitejs/vite"],"id":"vite","language":"TypeScript","license":"","name":"Vite","niche":"dev server/bundler","repo":"https://github.com/vitejs/vite","source_updated_at":null,"status":"active","summary":"新一代前端构建与开发服务器。","tags":["bundler","web"],"use_when":"要快速本地开发与现代打包","verification_status":"unverified","verified_at":null}
