{"avoid_when":"只要基础设施指标不要应用错误","content_hash":"6fe71deebecd7924788751d3465075420c8a522f1fa9d343c5b0987320e3c8b5","domain":"observability","evidence_urls":["https://github.com/getsentry/sentry"],"id":"sentry","language":"Python","license":"Apache-2.0","name":"Sentry","niche":"error tracking","repo":"https://github.com/getsentry/sentry","source_updated_at":"2026-07-21T15:11:08Z","status":"active","summary":"应用错误监控与性能追踪平台。","tags":["apm","errors","observability"],"use_when":"要错误聚合、发行版追踪与前端/后端 APM","verification_status":"verified","verified_at":"2026-07-21T14:57:10Z"}
