{"avoid_when":"需要巨型现成集成市场","content_hash":"61ae0a29538c9e5bd245c2b477e3263519f6af12c71ec908513383d6b8a7544b","domain":"ai-agents","evidence_urls":["https://github.com/pydantic/pydantic-ai"],"id":"pydantic-ai","language":"Python","license":"MIT","name":"Pydantic AI","niche":"typed python agents","repo":"https://github.com/pydantic/pydantic-ai","source_updated_at":"2026-07-21T15:06:31Z","status":"active","summary":"Pydantic 团队的类型友好 Agent 框架，结构化输出强。","tags":["agent-framework","prompt"],"use_when":"要强类型、依赖注入式 Agent 与结构化结果","verification_status":"verified","verified_at":"2026-07-21T13:49:42Z"}
