{"avoid_when":"多语言或要跨语言统一引擎","content_hash":"d9cdbe01bb0b860805e9b199ea913a1fd9a06886fb7d4e2fb350d2ac5f2b718e","domain":"security","evidence_urls":["https://github.com/PyCQA/bandit"],"id":"bandit","language":"Python","license":"Apache-2.0","name":"Bandit","niche":"python sast","repo":"https://github.com/PyCQA/bandit","source_updated_at":"2026-07-21T00:59:27Z","status":"active","summary":"Python 安全问题静态检查。","tags":["python","sast"],"use_when":"Python 项目要基础安全 lint","verification_status":"verified","verified_at":"2026-07-21T13:52:28Z"}
