{"avoid_when":"要可视化编辑器或 3D 引擎","content_hash":"9593680094848e998ee60fa4c7afeede4f290413dd477f7e990e860890f89ce7","domain":"gamedev","evidence_urls":["https://github.com/love2d/love"],"id":"love2d","language":"C++","license":"Zlib","name":"LÖVE","niche":"lua 2d","repo":"https://github.com/love2d/love","source_updated_at":"2026-07-21T20:57:00Z","status":"active","summary":"Lua 2D 游戏框架，脚本驱动、上手快。","tags":["gamedev"],"use_when":"要用 Lua 快速做 2D 游戏原型","verification_status":"verified","verified_at":"2026-07-21T20:57:00Z"}
