{"avoid_when":"需要 Elasticsearch 级复杂生态","content_hash":"31539146cef623bc63b3cb3352b8e7071a3b4f186ef2c960fe5b71f06ae4be97","domain":"databases","evidence_urls":["https://github.com/meilisearch/meilisearch"],"id":"meilisearch","language":"Rust","license":"MIT AND BUSL-1.1","name":"Meilisearch","niche":"search engine","repo":"https://github.com/meilisearch/meilisearch","source_updated_at":"2026-07-21T14:35:05Z","status":"active","summary":"易用的全文搜索引擎。","tags":["search"],"use_when":"要快速上线的搜索体验","verification_status":"verified","verified_at":"2026-07-21T14:57:10Z"}
