{"avoid_when":"要 React 组件化文档体验","content_hash":"ab446f1e30b6f4abd65ff299b2a8bc949282610daa25df29ba94c0e4d202ae4c","domain":"cms-docs","evidence_urls":["https://github.com/mkdocs/mkdocs"],"id":"mkdocs","language":"Python","license":"BSD-2-Clause","name":"MkDocs","niche":"docs site","repo":"https://github.com/mkdocs/mkdocs","source_updated_at":"2025-10-20T13:17:06Z","status":"active","summary":"Python Markdown 文档静态站点。","tags":["docs","python","static-site"],"use_when":"Python 项目要用 Markdown 出文档站","verification_status":"verified","verified_at":"2026-07-21T13:52:28Z"}
