{"avoid_when":"要处理超大流式数据且 jq 内存吃紧","content_hash":"06cb0294b7883ce5db412b41473a69d72f6c7d6892ea62a81348f09e3838ec47","domain":"devtools","evidence_urls":["https://github.com/jqlang/jq"],"id":"jq","language":"C","license":"","name":"jq","niche":"json cli","repo":"https://github.com/jqlang/jq","source_updated_at":null,"status":"active","summary":"命令行 JSON 处理器。","tags":["cli","data","json"],"use_when":"在 shell 里解析/变换 JSON","verification_status":"unverified","verified_at":null}
