{"avoid_when":"只要单机短周期指标","content_hash":"d0fb1fab181e3876525125ded1b3ec2ba38fc5ef704781fb94377f4e7ad0bf87","domain":"observability","evidence_urls":["https://github.com/thanos-io/thanos"],"id":"thanos","language":"Go","license":"","name":"Thanos","niche":"metrics","repo":"https://github.com/thanos-io/thanos","source_updated_at":null,"status":"active","summary":"Prometheus 高可用与长期存储组件。","tags":["metrics","observability"],"use_when":"多集群 Prometheus 要全局查询与对象存储","verification_status":"unverified","verified_at":null}
