{"avoid_when":"已深度绑定 Terraform 生态且无语言 IaC 需求","content_hash":"47bb1c90d5a4a2161295f2fdddb40c2c65eb7858d294938744818c2f9184eac4","domain":"devops","evidence_urls":["https://github.com/pulumi/pulumi"],"id":"pulumi","language":"Go","license":"Apache-2.0","name":"Pulumi","niche":"programming-language IaC","repo":"https://github.com/pulumi/pulumi","source_updated_at":"2026-07-21T15:06:32Z","status":"active","summary":"用通用语言写 IaC（TS/Python 等）。","tags":["devops","iac"],"use_when":"团队更想用熟悉语言而不是 HCL 写基础设施","verification_status":"verified","verified_at":"2026-07-21T13:49:42Z"}
