{"avoid_when":"只要最简单本地聊天","content_hash":"6e80d7f693c6d127106c03d8b6812b8fffe16fda2ca6fb463f1e6f2b09bc42c3","domain":"ai-agents","evidence_urls":["https://github.com/sgl-project/sglang"],"id":"sglang","language":"Python","license":"","name":"SGLang","niche":"structured generation runtime","repo":"https://github.com/sgl-project/sglang","source_updated_at":null,"status":"active","summary":"结构化生成与高吞吐推理运行时。","tags":["llm-api","local-llm"],"use_when":"自托管推理且在意结构化解码/吞吐","verification_status":"unverified","verified_at":null}
