{"avoid_when":"必须全盘 Web 技术栈","content_hash":"495d2222c093da00a3646117e31af7e91cc3516ad465d0b6bf9b1854c094ed20","domain":"desktop","evidence_urls":["https://github.com/slint-ui/slint"],"id":"slint","language":"Rust","license":"","name":"Slint","niche":"declarative native","repo":"https://github.com/slint-ui/slint","source_updated_at":null,"status":"active","summary":"声明式原生 UI 工具包，多语言绑定。","tags":["desktop","native-ui","rust"],"use_when":"要现代声明式原生 UI 且可嵌 Rust/C++/JS","verification_status":"unverified","verified_at":null}
