{"avoid_when":"必须严格 Grafana-only 官方组件","content_hash":"cc66819ba6c23001b235ae22c4fa0df37dc1853886451a8dd089047508cc026c","domain":"observability","evidence_urls":["https://github.com/VictoriaMetrics/VictoriaMetrics"],"id":"victoriametrics","language":"Go","license":"","name":"VictoriaMetrics","niche":"metrics","repo":"https://github.com/VictoriaMetrics/VictoriaMetrics","source_updated_at":null,"status":"active","summary":"高性能、低成本的 Prometheus 兼容时序库。","tags":["metrics","observability"],"use_when":"要更省资源的 Prometheus 兼容存储","verification_status":"unverified","verified_at":null}
