{"avoid_when":"要强类型代码一等公民控制","content_hash":"204d1f911d10f7f2471d09d5476cbb6a379b53ae1ab1cc71c929a85d76b53890","domain":"ai-agents","evidence_urls":["https://github.com/FlowiseAI/Flowise"],"id":"flowise","language":"TypeScript","license":"","name":"Flowise","niche":"visual LLM builder","repo":"https://github.com/FlowiseAI/Flowise","source_updated_at":null,"status":"active","summary":"可视化 LLM 编排 UI，偏 LangChain 生态。","tags":["agent-framework","orchestration","ui"],"use_when":"要用拖拽快速搭 LLM 流","verification_status":"unverified","verified_at":null}
