{"avoid_when":"完全使用 GitHub 托管 runner 且无自托管需求","content_hash":"cef74120cd7d94e77c9eaa3f3cc2aeb31131306572a39155e29f1e942334a60f","domain":"devops","evidence_urls":["https://github.com/actions/runner"],"id":"github-actions-runner","language":"C#","license":"","name":"actions/runner","niche":"CI self-hosted runner","repo":"https://github.com/actions/runner","source_updated_at":null,"status":"active","summary":"GitHub Actions 自托管 Runner。","tags":["ci","devops"],"use_when":"要在自有机器跑 GitHub Actions 任务","verification_status":"unverified","verified_at":null}
