{"avoid_when":"需要多写高并发网络数据库服务","content_hash":"11ef3d0c3fbcf876fcb81b360c42dfdad1eda999556f8231f565c306dfeb5c42","domain":"databases","evidence_urls":["https://github.com/sqlite/sqlite"],"id":"sqlite","language":"C","license":"blessing","name":"SQLite","niche":"embedded sql","repo":"https://github.com/sqlite/sqlite","source_updated_at":"2026-07-21T13:30:16Z","status":"active","summary":"嵌入式单文件 SQL 引擎。","tags":["embedded","sql"],"use_when":"嵌入式/本地/测试要零运维 SQL","verification_status":"verified","verified_at":"2026-07-21T15:05:45Z"}
