{"avoid_when":"要生产级付费数据源 SLA","content_hash":"cecac28758483d90ea1ec1e81ba485247c089bc7b581cb6f0f2df3662a4f9449","domain":"finance","evidence_urls":["https://github.com/ranaroussi/yfinance"],"id":"yfinance","language":"Python","license":"","name":"yfinance","niche":"market data","repo":"https://github.com/ranaroussi/yfinance","source_updated_at":null,"status":"active","summary":"Yahoo Finance 行情下载器。","tags":["finance","market-data","python"],"use_when":"快速拉股票/ETF 历史行情做研究","verification_status":"unverified","verified_at":null}
