[{"avoid_when":"要生产级安全与复杂网络栈","content_hash":"5b48cd0a2c8a23cc72a10ea0d9acc76bd80b8a903346dc9617fe82e14d541fcb","domain":"iot","evidence_urls":["https://github.com/arduino/ArduinoCore-avr"],"id":"arduino-core","language":"C++","license":"","name":"Arduino Core","niche":"maker","repo":"https://github.com/arduino/ArduinoCore-avr","source_updated_at":null,"status":"active","summary":"Arduino AVR 核心（入门嵌入式生态代表）。","tags":["embedded","iot","maker"],"use_when":"教学/创客快速原型","verification_status":"unverified","verified_at":null},{"avoid_when":"只要纯开源自建训练管线","content_hash":"b61a1482f8cd98ab16b0a680c83bc158158ffa1bdaa5078c4b5a9c2c23f1b602","domain":"iot","evidence_urls":["https://github.com/edgeimpulse/edge-impulse-cli"],"id":"edge-impulse-cli","language":"TypeScript","license":"","name":"Edge Impulse CLI / tooling refs","niche":"tinyml tooling","repo":"https://github.com/edgeimpulse/edge-impulse-cli","source_updated_at":null,"status":"active","summary":"边缘 ML 数据采集与部署工具链入口。","tags":["iot","tinyml","tooling"],"use_when":"要加速嵌入式 ML 数据到模型闭环","verification_status":"unverified","verified_at":null},{"avoid_when":"家庭实验室只要 Mosquitto","content_hash":"18eb727493de1fd747fc708f67aabf48fa4f8abfcfb820f8d0bc8a574862f489","domain":"iot","evidence_urls":["https://github.com/emqx/emqx"],"id":"emqx","language":"Erlang","license":"","name":"EMQX","niche":"mqtt broker","repo":"https://github.com/emqx/emqx","source_updated_at":null,"status":"active","summary":"大规模可扩展 MQTT 平台。","tags":["iot","messaging","mqtt"],"use_when":"要高并发 MQTT 与规则引擎","verification_status":"unverified","verified_at":null},{"avoid_when":"只要快速 YAML 刷机（ESPHome）","content_hash":"6bf2c46477d5f74b5961dbfcc8f4b2d4ca1191860e759ee62ce15d3d34ea312f","domain":"iot","evidence_urls":["https://github.com/espressif/esp-idf"],"id":"esp-idf","language":"C","license":"","name":"ESP-IDF","niche":"esp sdk","repo":"https://github.com/espressif/esp-idf","source_updated_at":null,"status":"active","summary":"乐鑫官方 IoT 开发框架。","tags":["esp","firmware","iot"],"use_when":"要官方级 ESP32 深度开发","verification_status":"unverified","verified_at":null},{"avoid_when":"要完全手写底层 IDF 驱动","content_hash":"507453dd50c99703d99118b1e0759367a7268691b3e1eeaac7f79d5975519deb","domain":"iot","evidence_urls":["https://github.com/esphome/esphome"],"id":"esphome","language":"Python","license":"","name":"ESPHome","niche":"esp firmware","repo":"https://github.com/esphome/esphome","source_updated_at":null,"status":"active","summary":"用 YAML 配置 ESP 设备固件。","tags":["esp","firmware","iot"],"use_when":"要用声明式配置刷 ESP 传感器/开关","verification_status":"unverified","verified_at":null},{"avoid_when":"要完整发行版式 Zephyr 设备模型","content_hash":"61c706b196dc085a193d21416d3cbc13a475103f25dd319199e4cd0cfb6f7473","domain":"iot","evidence_urls":["https://github.com/FreeRTOS/FreeRTOS"],"id":"freertos","language":"C","license":"","name":"FreeRTOS","niche":"rtos","repo":"https://github.com/FreeRTOS/FreeRTOS","source_updated_at":null,"status":"active","summary":"广泛使用的实时操作系统内核。","tags":["embedded","iot","rtos"],"use_when":"要成熟轻量 RTOS 内核与生态","verification_status":"unverified","verified_at":null},{"avoid_when":"只要单设备脚本无家庭场景","content_hash":"609d1498c6c9963ec2cb82a4cdd45cd061b587123870dea75fa15d6b01a21351","domain":"iot","evidence_urls":["https://github.com/home-assistant/core"],"id":"home-assistant","language":"Python","license":"","name":"Home Assistant","niche":"home automation","repo":"https://github.com/home-assistant/core","source_updated_at":null,"status":"active","summary":"开源家庭自动化平台。","tags":["home-automation","iot"],"use_when":"要自托管智能家居中枢与海量集成","verification_status":"unverified","verified_at":null},{"avoid_when":"只要应用层 MQTT 设备控制","content_hash":"1fcb0046400d4afa3a57b55c22172a6e57d20ebe4019c38f9e7e7d02981d4047","domain":"iot","evidence_urls":["https://github.com/kismetwireless/kismet"],"id":"kismet","language":"C++","license":"","name":"Kismet","niche":"wireless monitor","repo":"https://github.com/kismetwireless/kismet","source_updated_at":null,"status":"active","summary":"无线网络侦测与监测。","tags":["iot","security","wireless"],"use_when":"要监测 Wi-Fi/蓝牙等无线环境","verification_status":"unverified","verified_at":null},{"avoid_when":"只要应用层集成现成 Matter 设备","content_hash":"458302c0b6af74c328e343054786acff7982a4b93cabbddfcbe3bc77c2cb3946","domain":"iot","evidence_urls":["https://github.com/project-chip/connectedhomeip"],"id":"matter","language":"C++","license":"","name":"connectedhomeip (Matter)","niche":"matter","repo":"https://github.com/project-chip/connectedhomeip","source_updated_at":null,"status":"active","summary":"Matter 智能家居互联标准参考实现。","tags":["iot","matter","standards"],"use_when":"要做 Matter 设备/控制器开发","verification_status":"unverified","verified_at":null},{"avoid_when":"只要云厂商托管 MQTT","content_hash":"92eea75fd701fdc8d3bac91bb8667f2f87c31ccbd7e60056242c3f26e843da09","domain":"iot","evidence_urls":["https://github.com/eclipse/mosquitto"],"id":"mosquitto","language":"C","license":"","name":"Eclipse Mosquitto","niche":"mqtt broker","repo":"https://github.com/eclipse/mosquitto","source_updated_at":null,"status":"active","summary":"轻量 MQTT broker。","tags":["iot","messaging","mqtt"],"use_when":"要自托管 MQTT 消息总线","verification_status":"unverified","verified_at":null},{"avoid_when":"要强类型大型后端系统","content_hash":"7d97abedac3cdd51590de58449e6fe7e74451878152a44842e36516dbde518da","domain":"iot","evidence_urls":["https://github.com/node-red/node-red"],"id":"nodered","language":"JavaScript","license":"","name":"Node-RED","niche":"flow automation","repo":"https://github.com/node-red/node-red","source_updated_at":null,"status":"active","summary":"基于流的低代码自动化编排。","tags":["automation","iot","low-code"],"use_when":"要用可视化流连接设备与服务","verification_status":"unverified","verified_at":null},{"avoid_when":"更熟 Home Assistant 生态","content_hash":"9d32f29f9eb9b668ff5ea32daf3cd1e6f4be013a66c1b50ffdc666a4c5b269ed","domain":"iot","evidence_urls":["https://github.com/openhab/openhab-core"],"id":"openhab","language":"Java","license":"","name":"openHAB","niche":"home automation","repo":"https://github.com/openhab/openhab-core","source_updated_at":null,"status":"active","summary":"开源家庭自动化运行时。","tags":["home-automation","iot"],"use_when":"要规则引擎强的家庭自动化替代","verification_status":"unverified","verified_at":null},{"avoid_when":"只要单板 Arduino IDE 最简流程","content_hash":"6fd05ff9364758babe5bd3fa7c768b36ba4e41c7a41f34332cce9b8b9771dafb","domain":"iot","evidence_urls":["https://github.com/platformio/platformio-core"],"id":"platformio","language":"Python","license":"","name":"PlatformIO","niche":"embedded tooling","repo":"https://github.com/platformio/platformio-core","source_updated_at":null,"status":"active","summary":"嵌入式开发的专业 IDE/构建系统。","tags":["embedded","iot","tooling"],"use_when":"要多平台嵌入式构建与库管理","verification_status":"unverified","verified_at":null},{"avoid_when":"设备不支持或要官方保修","content_hash":"40bf20c44b7b1f917b398991f7247c95b77b9c244c1dccfdbeddfcfa42416ab0","domain":"iot","evidence_urls":["https://github.com/arendst/Tasmota"],"id":"tasmota","language":"C++","license":"","name":"Tasmota","niche":"device firmware","repo":"https://github.com/arendst/Tasmota","source_updated_at":null,"status":"active","summary":"替代固件，常用于智能插座/继电器。","tags":["firmware","iot","mqtt"],"use_when":"要刷开源固件接管消费级 Wi-Fi 设备","verification_status":"unverified","verified_at":null},{"avoid_when":"有 GPU/服务器可跑完整框架","content_hash":"7db3043787d7808d0a0e9f27358ff865c29f6721137fef01deac555eaf5350ae","domain":"iot","evidence_urls":["https://github.com/tensorflow/tflite-micro"],"id":"tinyml-tflite-micro","language":"C++","license":"","name":"TensorFlow Lite for Microcontrollers","niche":"tinyml","repo":"https://github.com/tensorflow/tflite-micro","source_updated_at":null,"status":"active","summary":"微控制器上的轻量推理。","tags":["embedded","iot","tinyml"],"use_when":"要在 MCU 跑小型 ML 推理","verification_status":"unverified","verified_at":null},{"avoid_when":"只要 Arduino 级入门原型","content_hash":"f27e4432aceb732fd4b0d344f89f5fabb600d10c4710e7a6f4d6f68637e08c64","domain":"iot","evidence_urls":["https://github.com/zephyrproject-rtos/zephyr"],"id":"zephyr","language":"C","license":"","name":"Zephyr","niche":"rtos","repo":"https://github.com/zephyrproject-rtos/zephyr","source_updated_at":null,"status":"active","summary":"可扩展实时操作系统，面向受限设备。","tags":["embedded","iot","rtos"],"use_when":"要跨芯片的现代嵌入式 RTOS","verification_status":"unverified","verified_at":null},{"avoid_when":"全屋已是 Z-Wave/Matter 且无 Zigbee","content_hash":"be8e55ed7c83e4b0adda063d1fca87d29dc9d6be5c4a942ed8fdc4c7fd7f512c","domain":"iot","evidence_urls":["https://github.com/Koenkk/zigbee2mqtt"],"id":"zigbee2mqtt","language":"TypeScript","license":"","name":"Zigbee2MQTT","niche":"zigbee bridge","repo":"https://github.com/Koenkk/zigbee2mqtt","source_updated_at":null,"status":"active","summary":"把 Zigbee 设备桥到 MQTT。","tags":["iot","mqtt","zigbee"],"use_when":"要用 MQTT 统一接入 Zigbee 设备","verification_status":"unverified","verified_at":null},{"avoid_when":"无 Z-Wave 硬件","content_hash":"23be0264731e0952c9f81ed6b632ad27a072813bb3993a0f4333f3ce93862171","domain":"iot","evidence_urls":["https://github.com/zwave-js/node-zwave-js"],"id":"zwave-js","language":"TypeScript","license":"","name":"Z-Wave JS","niche":"zwave","repo":"https://github.com/zwave-js/node-zwave-js","source_updated_at":null,"status":"active","summary":"现代 Z-Wave 驱动栈。","tags":["iot","zwave"],"use_when":"要驱动 Z-Wave 控制器与设备","verification_status":"unverified","verified_at":null}]
