{"avoid_when":"已选定 Argo CD 且无双栈需求","content_hash":"b74e72d0e37168c47be70136cc86bf0cca7844af1f216795b07ad6f179f32f58","domain":"devops","evidence_urls":["https://github.com/fluxcd/flux2"],"id":"flux2","language":"Go","license":"","name":"Flux","niche":"gitops toolkit","repo":"https://github.com/fluxcd/flux2","source_updated_at":null,"status":"active","summary":"GitOps 工具集（CNCF）。","tags":["ci","devops","orchestration"],"use_when":"K8s GitOps 且偏 Flux 生态","verification_status":"unverified","verified_at":null}
