{"avoid_when":"团队标准已是 Kubernetes 且生态绑定深","content_hash":"1c02c77731d049304a5789645aeabe61ec04ea6aa9a053ee2ea958c2a3d9a15c","domain":"devops","evidence_urls":["https://github.com/hashicorp/nomad"],"id":"nomad","language":"Go","license":"MPL-2.0 OR BUSL-1.1","name":"Nomad","niche":"workload scheduler","repo":"https://github.com/hashicorp/nomad","source_updated_at":"2026-07-21T12:42:29Z","status":"active","summary":"HashiCorp 通用工作负载调度器，比 K8s 更轻。","tags":["devops","orchestration"],"use_when":"要调度容器/非容器任务又不想上满血 K8s","verification_status":"verified","verified_at":"2026-07-21T14:57:10Z"}
