{"avoid_when":"需要一体化容器扫描 UI","content_hash":"946bd3297ef4b6f2410804a9ab06ed66c10fa9c4cbd6636a111b7f842796f1bb","domain":"security","evidence_urls":["https://github.com/anchore/grype"],"id":"grype","language":"Go","license":"","name":"Grype","niche":"sbom vuln scan","repo":"https://github.com/anchore/grype","source_updated_at":null,"status":"active","summary":"基于 SBOM 的漏洞扫描器。","tags":["sbom","scanning"],"use_when":"已有 SBOM 要扫漏洞","verification_status":"unverified","verified_at":null}
