{"avoid_when":"只要文本 Agent/聊天","content_hash":"73527c7819ed36504e0467f2e8f95bca1f882eb29339b7ff38abd6d19987b36e","domain":"ai-agents","evidence_urls":["https://github.com/comfyanonymous/ComfyUI"],"id":"comfyui","language":"Python","license":"","name":"ComfyUI","niche":"node-based genUI","repo":"https://github.com/comfyanonymous/ComfyUI","source_updated_at":null,"status":"active","summary":"节点式生成式工作流 UI（图像等）。","tags":["orchestration","ui"],"use_when":"要可视化拼装生成式工作流","verification_status":"unverified","verified_at":null}
