{"avoid_when":"只需 JSON 且已用 jq 足够","content_hash":"564b92b4f5399bb394e3d6c82d9e5a67f150372da503b7dc6befd63c4069199d","domain":"devtools","evidence_urls":["https://github.com/mikefarah/yq"],"id":"yq","language":"Go","license":"","name":"yq","niche":"yaml cli","repo":"https://github.com/mikefarah/yq","source_updated_at":null,"status":"active","summary":"类 jq 的 YAML/JSON/XML 处理器。","tags":["cli","data","yaml"],"use_when":"在终端改/查 YAML 配置","verification_status":"unverified","verified_at":null}
